<xs:schema xmlns:xs="http://www.w3.org/2001/XMLSchema"
           targetNamespace="https://www.w3schools.com"
           xmlns="https://www.w3schools.com"
           elementFormDefault="qualified">
    <xs:element name="passwords">
        <xs:complexType>
            <xs:sequence>
                <xs:element name="user" maxOccurs="unbounded" minOccurs="0">
                    <xs:complexType>
                        <xs:sequence>
                            <xs:element name="username"/>
                            <xs:element name="password"/>
                            <xs:element name="mail"/>
                            <xs:element name="entry" maxOccurs="unbounded">
                                <xs:complexType>
                                <xs:sequence>
                                    <xs:element name="website" type="xs:string"/>
                                    <xs:element name="password"/>
                                    <xs:element name="username"/>
                                </xs:sequence>
                                </xs:complexType>
                        </xs:element>
                        </xs:sequence>
                    </xs:complexType>
                </xs:element>
            </xs:sequence>
        </xs:complexType>
    </xs:element>
</xs:schema>